{
  "gates": {
    "G-APP-HOST": {
      "evidence_refs": [],
      "status": "unapproved"
    },
    "G-APP-LINKS": {
      "evidence_refs": [],
      "status": "unapproved"
    },
    "G-CHANNELS": {
      "evidence_refs": [],
      "status": "unapproved"
    },
    "G-CLINICAL": {
      "evidence_refs": [],
      "status": "unapproved"
    },
    "G-CLOUD-ENTERPRISE": {
      "evidence_refs": [],
      "status": "unapproved"
    },
    "G-CLOUD-PILOT": {
      "evidence_refs": [],
      "status": "unapproved"
    },
    "G-COMPUTE": {
      "evidence_refs": [],
      "status": "unapproved"
    },
    "G-EDGE": {
      "evidence_refs": [],
      "status": "unapproved"
    },
    "G-EFFECT": {
      "evidence_refs": [],
      "status": "unapproved"
    },
    "G-ENTERPRISE-IDP": {
      "evidence_refs": [],
      "status": "unapproved"
    },
    "G-ENTERPRISE-SOURCES": {
      "evidence_refs": [],
      "status": "unapproved"
    },
    "G-FINAL": {
      "evidence_refs": [],
      "status": "unapproved"
    },
    "G-FINANCE-DATA": {
      "evidence_refs": [],
      "status": "unapproved"
    },
    "G-FINANCE-EXECUTION": {
      "evidence_refs": [],
      "status": "unapproved"
    },
    "G-FINANCE-RISK": {
      "evidence_refs": [],
      "status": "unapproved"
    },
    "G-MARKETPLACE": {
      "evidence_refs": [],
      "status": "unapproved"
    },
    "G-MCP-APPS": {
      "evidence_refs": [],
      "status": "unapproved"
    },
    "G-MODEL": {
      "evidence_refs": [],
      "status": "unapproved"
    },
    "G-OPERATIONS": {
      "evidence_refs": [],
      "status": "unapproved"
    },
    "G-RIVET-DYNAMIC": {
      "evidence_refs": [],
      "status": "unapproved"
    },
    "G-RUNNER": {
      "evidence_refs": [],
      "status": "unapproved"
    },
    "G-SOURCE": {
      "evidence_refs": [],
      "status": "unapproved"
    },
    "G-USABILITY": {
      "evidence_refs": [],
      "status": "unapproved"
    },
    "G-WHATSAPP": {
      "evidence_refs": [],
      "status": "unapproved"
    }
  },
  "profiles": {},
  "schema_version": "1.0",
  "tickets": {}
}
